{
 "schema_version": "7.0",
 "video": {
  "id": "3oWmy7F-Ja0",
  "title": "Stop Using ChatGPT for This: The Rise of AI Fraud",
  "channel": "Dark Horse Entrepreneur",
  "url": "https://www.youtube.com/watch?v=3oWmy7F-Ja0",
  "upload_date": "2026-09-22",
  "duration_s": 167,
  "view_count": 139,
  "transcript_provider": "cached",
  "transcript_chars": 2892,
  "transcript_is_whisper": false
 },
 "summary": "A short promo clip from Dark Horse Entrepreneur warning micro-business builders that some 'AI money' schemes are outright fraud, citing voice-clone and deepfake scams (a mother losing $15,000, a finance employee wiring $25 million) and long prison sentences for perpetrators. The speaker argues the legitimate opportunity is the trust problem fraud leaves behind: small businesses that help creators, coaches and brands prove their voice, content or identity is real. It is a teaser for a longer episode and gives no operator data.",
 "speakers": [
  {
   "name": "Dark Horse Entrepreneur host",
   "role": "host",
   "description": "Channel host targeting family-first micro-business builders; name not stated"
  }
 ],
 "format": "host_solo_ideas",
 "has_business_idea": true,
 "ideas": [
  {
   "local_id": "I1",
   "name": "Authenticity and voice-protection services for creators and small businesses",
   "one_liner": "Help creators, coaches and small brands protect their voice and likeness from cloning and prove their content or identity is genuine.",
   "category": "b2b_service",
   "business_model": "not stated (likely service fee or subscription)",
   "customer": "Creators, coaches, course creators and small businesses",
   "problem": "AI voice cloning and deepfakes erode trust and enable impersonation fraud",
   "offer": "Voice protection, content authentication and identity verification",
   "pricing": {
    "model": "not stated",
    "price_points": [],
    "notes": null
   },
   "acquisition_channels": [],
   "delivery": "not stated; speaker mentions research tools that protect voices from cloning and prove recordings are human.",
   "unit_economics_claims": [],
   "tools": [],
   "startup_cost": "not stated",
   "time_to_first_revenue": "not stated",
   "automation": {
    "acquisition": {
     "score_e": 3,
     "how": "Content and SEO around deepfake fears could run inbound."
    },
    "onboarding": {
     "score_e": 3,
     "how": "Self-serve sign-up feasible; identity checks may need review."
    },
    "delivery": {
     "score_e": 3,
     "how": "Could resell or wrap existing watermarking/provenance tools (e.g. content credentials) as software; advisory work is human."
    },
    "billing": {
     "score_e": 5,
     "how": "Subscriptions."
    },
    "support": {
     "score_e": 3,
     "how": "AI support with escalation for incidents."
    }
   },
   "uk_applicability": {
    "score_e": 4,
    "notes": "Deepfake fraud is a UK concern too; claims about protection must not be overstated (consumer protection/ASA)."
   },
   "risks": [
    "Vague idea with no proven product",
    "Technical arms race with cloning tools",
    "Over-promising protection"
   ],
   "is_primary": true,
   "depth": "moderate",
   "quotes": [
    {
     "text": "there's a wide-open lane for family-first ethical AI microbusinesses built on one simple idea: helping people and brands prove what's real.",
     "speaker": "Dark Horse Entrepreneur host",
     "match_score": 100.0,
     "verified": true,
     "char_offset": 1541,
     "approx_timestamp_s": 90
    },
    {
     "text": "Voice protection for creators, maybe. Authentication for small businesses.",
     "speaker": "Dark Horse Entrepreneur host",
     "match_score": 100.0,
     "verified": true,
     "char_offset": 1679,
     "approx_timestamp_s": 99
    }
   ]
  }
 ],
 "metric_claims": [
  {
   "claim": "AI-powered scams generate 4.5x more money per operation than old-school fraud",
   "metric": "revenue",
   "value": {
    "amount": 4.5,
    "currency": null,
    "unit": "multiple",
    "label": "AI scam yield vs traditional"
   },
   "period": null,
   "claimant": "Dark Horse Entrepreneur host",
   "first_hand": false,
   "hypothetical": false,
   "idea_local_id": null,
   "quote": {
    "text": "AI-powered scams are now generating four and a half times more money per operation than old-school fraud used to.",
    "speaker": "Dark Horse Entrepreneur host",
    "match_score": 100.0,
    "verified": true,
    "char_offset": 560,
    "approx_timestamp_s": 33
   }
  },
  {
   "claim": "Voice clone scam cost a mother $15,000",
   "metric": "cost",
   "value": {
    "amount": 15000,
    "currency": "USD",
    "unit": "one-off",
    "label": null
   },
   "period": null,
   "claimant": "Dark Horse Entrepreneur host",
   "first_hand": false,
   "hypothetical": false,
   "idea_local_id": "I1",
   "quote": {
    "text": "Voice cloning cost a mom $15,000 cash because the call sounded exactly like her own daughter.",
    "speaker": "Dark Horse Entrepreneur host",
    "match_score": 100.0,
    "verified": true,
    "char_offset": 673,
    "approx_timestamp_s": 39
   }
  },
  {
   "claim": "Finance employee wired $25 million after a deepfake video call",
   "metric": "cost",
   "value": {
    "amount": 25000000,
    "currency": "USD",
    "unit": "one-off",
    "label": null
   },
   "period": null,
   "claimant": "Dark Horse Entrepreneur host",
   "first_hand": false,
   "hypothetical": false,
   "idea_local_id": "I1",
   "quote": {
    "text": "A finance employee once wired $25 million after a video call with executives who weren't even real people.",
    "speaker": "Dark Horse Entrepreneur host",
    "match_score": 100.0,
    "verified": true,
    "char_offset": 765,
    "approx_timestamp_s": 45
   }
  }
 ],
 "tactics": [
  {
   "name": "Find the trust problem a technology created",
   "area": "product",
   "steps": [
    "Pick one industry you already know",
    "Ask what people there would pay to prove is genuinely real (voice, content, identity)",
    "Write the answers down as business ideas"
   ],
   "idea_local_id": "I1",
   "quote": {
    "text": "Start small, pick one industry that you already know, ask what people in that space would pay to prove is genuinely real.",
    "speaker": "Dark Horse Entrepreneur host",
    "match_score": 100.0,
    "verified": true,
    "char_offset": 2108,
    "approx_timestamp_s": 124
   }
  }
 ],
 "tools_mentioned": [
  {
   "name": "ChatGPT",
   "purpose": "Used by side hustlers; warned against fraudulent uses",
   "cost_stated": null
  }
 ],
 "warnings": [
  {
   "warning": "Some 'AI side hustles' are fraud; operators face arrests, 10-year minimums and 15-year sentences.",
   "quote": {
    "text": "the fastest way some people are making money with AI right now isn't a hack, it's a felony.",
    "speaker": "Dark Horse Entrepreneur host",
    "match_score": 100.0,
    "verified": true,
    "char_offset": 124,
    "approx_timestamp_s": 7
   }
  },
  {
   "warning": "Voice cloning and deepfake video calls are being used to steal large sums; businesses need verification steps for payments.",
   "quote": null
  }
 ],
 "lessons": [
  {
   "lesson": "When a technology destroys trust, it creates a market for rebuilding it.",
   "theme": "niche_selection",
   "quote": {
    "text": "Every time a technology destroys trust, it creates a market for rebuilding it.",
    "speaker": "Dark Horse Entrepreneur host",
    "match_score": 100.0,
    "verified": true,
    "char_offset": 1233,
    "approx_timestamp_s": 72
   }
  },
  {
   "lesson": "Look at what a new technology breaks, not only what it creates, to find business problems.",
   "theme": "niche_selection",
   "quote": {
    "text": "While everyone's staring at what AI can create, almost no one is asking what AI just broke.",
    "speaker": "Dark Horse Entrepreneur host",
    "match_score": 100.0,
    "verified": true,
    "char_offset": 1143,
    "approx_timestamp_s": 67
   }
  },
  {
   "lesson": "Build legitimately: the opportunity is protecting people from deception, not getting better at it.",
   "theme": "legal_risk",
   "quote": {
    "text": "The opportunity isn't becoming better at deception. It's becoming useful to everyone who now needs protection from that deception.",
    "speaker": "Dark Horse Entrepreneur host",
    "match_score": 100.0,
    "verified": true,
    "char_offset": 2549,
    "approx_timestamp_s": 150
   }
  },
  {
   "lesson": "Start with an industry you already know when hunting for problems to solve.",
   "theme": "niche_selection",
   "quote": null
  }
 ],
 "evidence_quality": {
  "rating": "D",
  "rationale": "Under three-minute teaser with second-hand fraud statistics and a vague business direction; no operator, pricing or process.",
  "promotional_conflict": "Promotes the channel's full episode."
 },
 "extraction": {
  "model": "grokbot",
  "extracted_at": "2026-10-22T09:05:59",
  "cost_usd": null,
  "reviewed_by": null,
  "review_notes": null,
  "quote_verification": {
   "quotes": 10,
   "verified": 10,
   "rate": 1.0
  },
  "schema_errors": []
 }
}